{
    "reviewId": "7B5DEB70-F109-44CA-88E2-264842B6473F",
    "reviewReferenceId": "75159-2017-000010",
    "reviewStatus": "Assigned",
    "distributionDate": "2017-07-19 23:40:13.980",
    "receivedDate": "2017-07-22 09:10:20.980",
    "requestedDate": "2017-07-20 08:00:20.980",
    "selectionDate": "2017-07-19 23:40:13.980",
    "selectionStatus": "Received"
}